117,"The guards ushered Frank into the office. As usual, the Reverend Publisher was seated at her desk, writing.So many lives touched by her decisions, he thought.""Well?""She looked up. He had promised himself that he would not flinch before the fire of her gaze, and once more he broke his promise.""It is... almost finished.""""Almost."" Her irony was palpable, a force. ""Almost is not enough. You know that, Frank. When will it be done?""""I think... a month. At most two. I am working as hard as I can, Reverend Publisher. I am... not well.""He hated himself for his servility.""So, why then did you found a dynasty? Your son can assist you. He will continue when you are gone. There are many books left to write.""His throat was suddenly dry. But of course there was no pitcher of water. It would have been unthinkable.""I am... preparing him. He will be ready in time.""She glanced at him again, and again he flinched. ""There is a transcriber on that desk. Write a page now. I want to see how you work.""He sat down, and fed a sheet of paper into the machine. His lips moved soundlessly. She knew what he was saying. By now, the Litany was stamped deep into his psyche, impossible to eradicate. She smiled secretly to herself. The training was brutal, but it was effective. She watched his mouth, as it formed the words it had spoken so many times before:
I have no taste.Taste is the sales-killer, the hesitation that brings total profit meltdown.I will conquer my taste.When I have stamped it out, I will look at what I have written.I will read through it from start to finish.There will be nothing left of a great series.Only crap will remain.
"
117,"I know, you are like, wait, 5 stars? Really? And I am, like, I really enjoyed this book. I mean, I learned about much of the Dune universe that was never mentioned in the first four books (sex, Ix, the Tleilaxu, the Bene Geserit proscription of love...) and I really liked Teg and Odrade and even Lucillle and the new ghola. The action was great especially at the end (even if Teg’s capture of the Honored Matre’s no-ship was frustratingly fast-forwarded). Philosophically, there was a LOT to chew on and the tech was probably the most diverse and interesting of all the Dune series since the first one. On to Chapterhouse!Fino's Dune ReviewsDuneDune MessiahChildren of DuneGod Emperor of DuneHeretics of DuneChapterhouse: Dune"
117,"I have to admit that I put this one on the backburner for years and years and years, even though I attempted to re-read the series several times over the decades, I always got stuck right at the end of God Emperor of Dune and something in me just didn't want to pick up the two novels afterward.This is strange to me! I thought the fifth and sixth books were rather awesome, frankly! And that's why I'm skipping books 2, 3, and 4 altogether and jumping right back in to the books that I have only read once. And then I'll be picking up the series carried on by Anderson and Frank's son following the events of Chapterhouse. So how did I think this book held up after all these years?Pretty good! There were a few slow parts, but the one thing that Heretics does very well is the worldbuilding. The Great God Leto II has been dead for 1.5k years after taking a dip in the aquaduct, turning into sandtrout that have now become full sandworms. That means that poor Paul's son has a trapped consciousness inside these gigantic monstrosities after having lived for 5k years. (Since birth+as a sandworm+trapped consciousness.) Freaky cool. And of course religion has a bit part to play in these books as they always have.What's most interesting is Miles Teg and the new Duncan Idaho. The similarities between Teg and the original Leto is pretty suggestive and the spice trance doubly so. His little transformation blew me away both times I read it. But Duncan Idaho? The obsessively resurrected clone of the original that has come back nearly countless times over 5k years? It staggers the imagination. Leto II really put him through the ringer, but even after the old god had died, the Bene Gesserit and the Bene Tlailax have turned him into the stage of their own conflict.And it's these two that really own the stage in this side of the universe.... until the great spreading of humanity came back. :) Enter conflict. :) So good.This is one of those series that take a lot of dedication and understanding to really enjoy. You really have to get deep into them, but they're very, very enjoyable, and this one is very complex and deep in a very similar way to the original classic. Tons of politics and machinations, and if you love that, you'll love this. :) "
117,"Not much time has passed since the events in the end of the previous book – measly 1500 years. Considering the fact that God Emperor was an undisputed ruler of the known Universe for exactly 3 times as long as that, this time period is nothing. As such not much has changed – believe it or not. For comparison take modern state of humanity and that of 1500 years ago and think whether it is possible at all for humans to stagnate for this long. I honestly do not believe it.Anyhow, with the God Emperor finally out of the picture the power-grab games are in full swing with everybody trying to out-power everybody else, the consequences and such minor annoyances as countless lives of insignificant people be damned. To add to the fun, a new and a very dangerous fraction came into being – completely out of the blue and unexpected I might add. Their bid for power shapes the majority of the book. As Leto II never bothered to explain (or even to hint) what the Golden Path is, it is not clear whether these new people are part of the plan, or whether they were as unexpected by the guy as by us readers. Let me start by saying this book is miles ahead of the previous one in terms of quality and excitement. The main reason for this is that it takes a special kind of talent to write something worse than God Emperor of Dune. That one consisted of pointless philosophical rumblings for about three fourths and teen angst (of the worst kind) in the last quarter – coming from a creature who lived 35 centuries, no less. This tale starts with cloning of Duncan Idaho. Let me put some things in the perspective. He was initially cloned in book 2 which was kind of cheap trick to bring a dead guy back, but it least that action served a very well explained purpose. In book 4 Leto II kept cloning the guy non-stop during his endless reign (3500 years – in case you forgot). At that point this particular trope has overstayed its welcome. You can imagine that this same act in the beginning of this book felt like a really bad joke – I hoped the madness would stop after Leto II was out of the picture. To add an insult to the injury, nobody bothers to explain what was so outstanding about the guy to begin with: he was loyal and heroic, but he did not possess any qualities making his presence necessary for literally everybody and their brother in the Universe. Every single action was revolved around his brand new sparkling clone and nobody seems to have any clue why he is so goddamn important. On the positive side nobody makes long speeches anymore; this is a major improvement. As the book is slightly under 500 pages this means stuff actually happens unlike in the previous book. In fact there were some really fast-paced moments. If only somebody bothered to explain why people did what they did, I would have appreciated them so much more. On the negative side I could not care less about a single character. Often I found myself wishing all of them would perish at the end. Please do not get me wrong: I did not wish for all of them to die horribly; a gentle kind death would suffice. On one hand we have people returning from unknown parts of the Universe; they are pissed off at everybody and we do not have their POVs which makes it hard to learn their motivations. On the other hand we have the Bene Gesserit who are heartless by definition: killing all of their emotions – love first and foremost - is a part of their training. All of the power players are perfectly fine with completely wiping out the whole planets that had a misfortune of being in their way. So tell me, which side to root for? Another relevant question: why would I care about anybody? At least some of Bene Gesserit members have POVs. They face a mortal threat, but it does not stop them any from their own inside power struggle; business as usual. I already said this before, but it is worth repeating again: all of the problems of Bene Gesserit could be easily solved by having them work a regular soul-sucking work we all do from 9 to 5. The real life showed this to be true over and over again. At this point if you stop and think about it, the story took a completely different turn from the original classic book; the only things in common between them are some of the names. Everybody who is somehow significant is a descendent of Atreides line. Poor Duncan Idaho clone is the only exception. To my complete surprise the story has quite a big sexual themes with at least one very explicit description of a sex act. I am not a prude by any definition, but this looks completely out of place. By the way, do not expect that description I mentioned to be a good piece of erotic literature. So in conclusion this is light years ahead of the previous book. This one has exciting action scenes, intrigues, and double-crossings. I only wish somebody would bother explaining to me why all of these things were necessary. I give it 3 stars and leave it at this. "
117,"Buddy read with Athena!“The surest way to keep a secret is to make someone think they already know the answer.”The tyrant God Emperor has returned to the sands of Dune. The universe that was once ruled by Houses Corrino and Atreides have fallen into chaos and is controlled by dozens of bickering factions. The Bene Gesserit and the Tleilaxu struggle for power, but their ambitions are contested by billions of humans returning from the Scattering. But on the surface of Dune, a small girl might be able to break the balance when she finds that she is able to control the mighty sandworms themselves.Heretics of Dune is a giant improvement from the last book in the series, God Emperor of Dune. There are more characters, more hidden motives and overall a more interesting storyline. Still, there is much separating even this book from the three brilliant masterpieces of the Great Dune Trilogy. The epic feel is still gone, old boring characters are recycled, and even Frank Herbert's impressive pieces of social criticism are fewer and far between than they once were.While I enjoyed reading this book, I demand more from this series. What it needs is a breath of fresh air, and I don't know if Herbert was capable of providing that. But Dune is still one of my favourite series of all time, and my aim to read everything still stands."
249,"So, I was glancing through some of the reviews here and noticed that someone has totally disparaged this book because its “hero” is immoral. It always bewilders me when people judge a book according to the moral judgment that they pass on its characters. Like when I was looking at the reviews of John Updike’s Run, Rabbit and saw a woman saying that she hated the book because Angstrom left his wife twice in the book. I was like, don’t take it personally, lady; he’s not your husband. A lot of people do it. They ignore the book and get too tangled up in how likeable the characters are. I really don’t get this. Someone should explain it to me. Is Lolita a bad book because it’s about a pedophile? Should writers feel like their characters will be competing in a popularity contest in the minds of the readers? Should we then only read books about angels floating happily in Heaven, doing good things? Aren’t evil and immorality – whatever they mean – facts of life that should be dissected and explained by literature?I didn’t bother with the morality of the hero. I don’t care if he slept with a whore and then stole her money and ran away. Who cares? Look at all that delicious writing instead, all the ranting and raving of a tormented and brilliant mind, and the brutal honesty of it. I don’t know why publishers still insist on marketing this book for its “explicit language and breaking of sexual taboos in literature.” That’s just so passé in an age when even pornography makes us yawn. The beauty of this book lies somewhere else."
249,"This may be the greatest book ever written. This opening passage proves it:  ""I have no money, no resources, no hopes. I am the happiest man alive. A year ago, six months ago, I thought I was an artist. I no longer think about it. I am. Everything that was literature has fallen from me. There are no more books to be written, thank God.  This then? This is not a book. This is libel, slander, defamation of character. This is not a book, in the ordinary sense of the word. No, this is a prolonged insult, a gob of spit in the face of Art, a kick in the pants to God, Man, Destiny, Time, Love, Beauty ... what you will. I am going to sing for you, a little off key perhaps, but I will sing. I will sing while you croak, I will dance over your dirty corpse.... To sing you must first open your mouth. You must have a pair of lungs, and a little knowledge of music. It is not necessary to have an accordian, or a guitar. The essential thing is to want to sing. This then is a song. I am singing."" "
249,"I got through the first 150 pages before I decided that life is too short to waste time reading books you hate. Maybe I'm not smart enough or deep enough to appreciate a book like Tropic of Cancer, but for me each page was a tedious struggle. The author of the book's introduction boldy asserts that Henry Miller is ""the greatest living author"" (obviously, the edition I read was published prior to Miller's death in 1980), but I found Miller's frenetic, meandering style tiresome. Don't get me wrong, I'm not one to carelessly fling aside any book that doesn't capture my attention in the first 100 pages. Once I start a book, it's difficult for me to give it up, mostly because it makes me feel like a quitter; but I found myself getting angry as I grudgingly plodded through this one. I kept thinking, ""Henry, for chrissakes, give me something, ANYTHING to latch onto here!"" That's when I decided it was time to give up. Some semblance of a plot might have helped keep my interest piqued, but I don't think that storytelling was the author's aim. The long and short of it is - these kinds of books are not my cup of tea. "
249,"My fiction addictionHad lost all its frictionI needed raw meat but this new stuff was veggiePredictable, safe, and not bold, tough and edgyI thought Tropic of CancerWould be the answerFor years it was bannedThroughout every landBut five c words per pageSuppressed masculine rageAnd tours of French pudendaWas his only agendaSo reading Henry MillerJust made me feel illerAnd illerAnd illerAnd iller"
249,"I am going to create a new goodreads bookshelf titled ""sausage party."" It will exist solely for Henry Miller. "
38,"not a review and there probably won't be one any time soon. i also won't be climbing Mount Everest in the near future. but here are some cool illustrations that i found and want to share.



















World of the Ring by Jian Guo"
38,"Twenty-five years ago I'd have given The Lord of the Rings my highest possible praise. I came to Tolkien's masterpiece on my own, and that meant much to me at twelve. The only books that had been reached by me alone were books on mythology and horror. Everything else I read, from DH Lawrence to Hemingway to Dickens to Shakespeare (and this also included Dracula and Dr. Jeckyll and Mr. Hyde because they were ""true"" classics), was suggested and sanctioned by my mother (for which I will always owe her deeply).But The Lord of the Rings was mine and mine alone. It is easy to forget that The Lord of the Rings was not a pop culture phenomenon in the seventies and early eighties. It was a fringe book (at least in North America), something that was not yet considered a part of the canon, something that was not a name on every boy's lips (even if they were just getting to know D&D) let alone every child's lips. Sure it was respected and loved by those who knew it, but knowing it was not a foregone conclusion as it is today, and its audience was almost completely genre oriented. In my little community (my school and the blocks surrounding my home), I was the first kid to read it.And that first reading was a revelation. Sure I'd read The Hobbit, but that didn't prepare me for the breadth and depth of The Lord of the Rings. Middle Earth in its grandest incarnation. To create a fantasy world is one thing, but to breathe life into ages of that world, to keep all the pieces together with such magnificent detail and rigour, to create character after believable character and make us care about most of them, even poor Smeagol/Gollum, that is a literary labour of Hercules. And by pulling it off, Tolkien created the single most important manifestation of Fantasy that has ever and will ever be written. The Lord of the Rings has rightly been named a classic. It is part of the canon, and it deserves its place. It is entertaining, it is weighty, and it is loved by nearly all.Aye...and there's the rub.Its indisputable greatness has made it indisputable. It has become dogma among fanboys and fangirls that the bastions of The Lord of the Rings are unassailable. Criticize Tolkien's work -- academically or otherwise -- and you put yourself in almost as much danger as a chatty atheist trying to engage in a theological discussion in a coliseum full of Jehovah's Witnesses (how many of those folks will make it into the afterlife? Isn't there a limit?).Feminist critics point out the lack of women in The Lord of the Rings, and that those women who are present fulfill only the narrowest stereotypes. Éowyn's strength is dependent upon adopting male gender qualities, a typical stereotype of ""powerful women in fantasy,"" and she is alone amongst the Rohirrim as a woman who can and will fight. All other women in her culture are present as a reason to fight rather than as integral parts of the struggle. Arwen's place (in the books, at least) as a maiden waiting for the hand of her king takes the ""reason to fight"" to even greater heights. And the only powerful female, Galadriel as the terrible, beautiful elven Queen, is too far removed from mortality and reality to be anything more than a mid-tale deus ex machina, thereby removing her from the realm of women and men and making her a pseudo-god whose power is allowed only because it is arcane and mysterious. Post-Colonial critics have latched onto the racism inherent in The Lord of the Rings, pointing out the hierarchies between the races: from the ""superiority"" of the elves, to the ""chosen"" role of ""European"" Men of the West under the leadership of Aragorn, to the lesser races of Dwarves and Hobbits (the former are ""lesser"" because they are ""too greedy"" and the latter are ""lesser"" because they are children). Post-Colonialists look to the ""orientalization"" of Sauron's forces and the configuration of evil as an inherent quality of Orcs and ""the dark folk."" They point out Tolkien's family's history as a cog in the mechanism of English Imperialism, and his own birth in one of the most blatantly racist colonies of all, South Africa (while he did leave at three years old, his family's presence there at all suggests that some of the classic colonial opinions about the colonized ""dark races"" helped form the man who wrote these books), as possible reasons for this racism. These criticisms further suggest, at least to me, that the archetypal source of all fantasy's entrenched racism -- even those books being written today -- is The Lord of the Rings. Those fantasy authors who have followed Tolkien consistently and inescapably embrace his configuration of the races (yes, even those like R.A. Salvatore who try and fail to derail this configuration) and the concepts of good and evil that go along with them, which leads to the stagnation and diminishment of their genre.The fact is that these flaws do exist in The Lord of the Rings. They are present. They are easy to find. But few of Tolkien's rabid fans want to hear about them. And even when the criticism is not necessarily suggesting a flaw in Tolkien's work but merely the presence of some subtext, the dogmatists react with rage and condemnation. A fine example of this is when Queer and Gender theorists point to the overwhelming relationships between men, and how the relationship between Frodo and Sam is homosocial, at least, and possibly even homosexual. The only true intimacy in the book occurs between the men, after all, and to ignore that fact is to ignore one of key components of why The Lord of the Rings is so emotionally satisfying, especially to young men. Even faced with these ideas supported by convincing arguments, however, many fans either strive for ignorance or attack the messenger. This may have much to do with the worry -- unreasonable though it is -- that to admit that a flaw or something uncomfortable exists in any of these books, which so many people love so deeply, is to accept that The Lord of the Rings is neither great nor worthy of love.But this is not the case. I love The Lord of the Rings even though I subscribe completely to the post-colonial criticism, and see the merits in both the feminine and queer criticisms, not to mention the countless other criticisms and subtexts that are floating around.The books are racist; they are sexist. They are not perfect. And I must criticize the elements of The Lord of the Rings that make me uncomfortable and deserve no praise. But my complaints and the complaints of critics make Tolkien's achievement no less great. Tolkien created the most magnificent imaginary world ever conceived, and, for good or ill, Fantasy would be nothing today were it not for him. The Lord of the Rings is a triumph on countless levels, but it is not the word of God, nor should it be elevated to such heights.I love The Lord of the Rings, but I love it with reservations. I love it because of its place in my personal mythology, its genuine originality, its creativity, its power, but I love it with my mind open to its flaws, and I refuse to make excuses for Tolkien or his work.Twenty-five years ago I'd have given The Lord of the Rings my highest possible praise. Not today. But I am still willing to admit my love. "
