32,"Considering that The Lord of the Rings is one of the most popular books of the last century, it's surprising to see how few reviews there are here. I get the impression that many people feel guilty about liking it. It's a phase you go through, and the less said about it, the better. I think this is unfair to the book, which, I am prepared to argue, is a whole lot better than it's generally made out to be; I don't think its huge success is just evidence that people have no taste. It's something that can be read at more than one level, and, before dismissing it, let's take a look at what those levels might be. On the surface, it's a heroic fantasy novel, and quite a good one. It's a gripping, well-realized story, with an interesting fantasy world as background. Under the surface story, it's also clear that there's a moral discourse. It's not an allegory; as Tolkien points out in the foreword, he hated allegory, and we certainly don't have an in-your-face piece of Christian apology by numbers. None the less, the author has constructed some inspiring and thought-provoking symbols. The Ring confers great power, but the only way to defeat Sauron is to refuse that power, and destroy it, even at great personal cost. Frodo's self-sacrifice is quite moving. I also think that Gandalf is an unusually interesting Christ-figure; sufficiently so that many people refuse even to accept him as one, though, at least to me, the argument on that point seems convincing. He comes from Valinor, obviously the Heavenly Realm, to help the Free Peoples of the West. A central part of his message is the importance of mercy, as, in particular, shown by the memorable scene near the beginning, when he rebukes Frodo for wishing that Bilbo had killed Sméagol when he had the opportunity. As we discover, Sméagol is finally the one person who can destroy the Ring. And let's not miss the obvious point that Gandalf is killed, and then returns reborn in a new shape. I find him vastly more sympathetic than C.S. Lewis's bland Aslan, and he is the book's most memorable character.But I don't think the morality play is the real kernel either. What makes LOTR a unique book, and one of the most ambitious experiments in literary history, is Tolkien's use of names. All authors knows how important names are, and use them to suggest character; though when you think about what is going on, it is rather surprising how much can be conveyed just by a name. Proust has a couple of long discussions about this, describing in great detail how the narrator's initial mental pictures of Balbec, Venice and the Guermantes family come just from the sounds of their names. Tolkien goes much further. Most of his names are based on a family of invented languages, linked by a vast complex of legends and histories, the greater part of which are invisible to the reader and only surface occasionally. The astonishing thing is that the technique actually works. The interrelations between all the invented names and languages make Middle-Earth feel real, in a way no other fantasy world ever has. When some readers complain that characters and locations are hastily sketched, I feel they are missing the point. Tolkien was a philologist. He loved languages, words and names, and tracing back what the relationships between them say about their history. In LOTR, he's able to convey some of that love of language to his readers. You have to read the book more than once, but after a while it all comes together. To give just a few obvious examples, you see how ""hobbit"" is a debased form of the word holbytla (""hole-dweller"") in the Old Norse-like language of Rohan, how the ""mor"" in ""Moria"" is the same as the one in ""Mordor"" and ""morgul"", and how Arwen Undómiel's name expresses her unearthly beauty partly through the element it shares with her ancestor Lúthien Tinúviel. There are literally hundred more things like this, most of which one perceives on a partly unconscious level. The adolescent readers who are typically captivated by LOTR are at a stage of their linguistic development when they are very sensitive to nuances of language, and programmed to pick them up; I can't help thinking that they are intuitively seeing things that more sophisticated readers may miss.Perhaps the simplest way to demonstrate the magnitude of Tolkien's achievement is the fact that it's proven impossible to copy it; none of the other fantasy novels I've seen have come anywhere close. Tolkein's names lend reality to his world, because he put so much energy into the linguistic back-story, and before that worked for decades as a philologist. Basically, he was an extremely talented person who spent his whole life training to write The Lord of the Rings. In principle, I suppose other authors could have done the same thing. In practice, you have to be a very unusual person to want to live that kind of life.Writing this down reminds me of one of the Sufi stories in The Pleasantries of the Incredible Mullah Nasrudin. The guy is invited to a posh house, and sees this incredibly beautiful, smooth lawn. It's like a billiard table. ""I love your lawn!"" he says. ""What's the secret?""""Oh,"" his host says, ""It's easy. Just seed, water, mow and roll regularly, and anyone can do it!""""Ah yes!"" says the visitor, ""And about how long before it looks like that?""""Hm, I don't know,"" says the host. ""Maybe... 800 years?"""
32,"Writing a review of this masterpiece is impossible. I can’t do it. There’s too much to talk about and I love it far too much to articulate my thoughts in a normal way. So instead I’ve picked one element of each book that I liked the most (taken from my list of ten on each review) and added them here. It’s the best I can do, though I know many goodreads users share my difficulty when reviewing this book. Anyway, here’s my top three:1.Finding your courage- The Fellowship of the RingNot all the party have been fully tested. With them travel four young hobbits, the most unlikely of companions for such a journey. They are the overlooked, the forgotten about, the race that is casually discarded and considered insignificant in the wider world. And perhaps this has been the downfall of society in middle earth previously. The forces of darkness exploit everything they can get their hands on, from giant spiders to rampaging trolls, from dragons to orcs, from men of the east to the undead, Sauron tries to wield it all. This is something the forces of good have not fully considered until recently. Within the bosom of the hobbit beats a strong heart of fortitude and resilience. “My dear Frodo!’ exclaimed Gandalf. ‘Hobbits really are amazing creatures, as I have said before. You can learn all that there is to know about their ways in a month, and yet after a hundred years they can still surprise you at a pinch.” They carry with them the key to destroying the dark. Bilbo showed them how he could resist the ring. The hobbits are an almost incorruptible race, and because of this they are Sauron’s doom. It is something he has overlooked. “It would be the death of you to come with me, Sam,"" said Frodo, ""and I could not have borne that.""""Not as certain as being left behind,"" said Sam.""But I am going to Mordor.""""I know that well enough, Mr. Frodo. Of course you are. And I'm coming with you.” 2. Gandalf the White - The Two Towers“Do I not say truly, Gandalf,' said Aragorn at last, 'that you could go whithersoever you wished quicker than I? And this I also say: you are our captain and our banner. The Dark Lord has Nine. But we have One, mightier than they: the White Rider. He has passed through the fire and the abyss, and they shall fear him. We will go where he leads.Gandalf the Grey was charming and quirky; he was everybody’s friend and advisor. But he was also a great wonderer and a great quester. He was an unearther of dark secrets and mysteries. And Middle-Earth no longer needs such a figure, darkness is now on her doorstep; it is no longer hidden. So Middle-Earth needs a man (or Istari) with far sight that can unite the scattered forces of Rohan and manipulate events in order to ensure that the King does, indeed, return. It needs a methodical man of great wisdom and intelligence; it needs a stagiest: it needs a new white wizard now that Saruman has changed his colours. And he has come. 3.Girl Power!-The Return of the King“What do you fear, lady?"" [Aragorn] asked.""A cage,"" [Éowyn] said. ""To stay behind bars, until use and old age accept them, and all chance of doing great deeds is gone beyond recall or desire.”There have not been many moments for women to show their strength in this story. Arwen’s moment in the films was non-existent in the book. Frodo was saved on the river by an Elf-lord called Glorfindel. So when Eowen battled the Witch King, it is the first major moment Tolkien gave to a female hero. In a vastly male dominated genre, it was great to read this scene. If I have one criticism of Tolkien, it’s that we didn’t see more of such things.  And here's a gif I like:"
32,"One of the greatest trilogies of all time and certainly the measuring stick to which all subsequent fantasy-style writing is compared, The Lord of the Rings trilogy still stands at the top of the stack. Its realism, the characters and monsters, the storyline, the epic battles, and the quest motif are all drawn with incredible care by Tolkien in his chef-d'oeuvre. My favorite was The The Two Towers but all three are stunning. This edition, despite the awful cover art, contains all three books and the original appendices from The Return of the King. The one issue I have with this one is that the map of Middle Earth that should open The Two Towers is back in the appendices and relatively hard to find. It is also a rather large book and thus unwieldy for public transport commuting.I wanted to use this review to address a few overall themes of LOTR: symbolism, ecology, sexuality.
Symbolism
As for symbolism, as described in Tolkien, Tolkien's politics are not mapped onto the characters of Middle Earth in any obvious way. The symbols he uses go back before the Germanic invasions of Britain around 1000 because his goal is precisely to recreate the mythology that existed in England, Scotland and Wales before this period of instability and wanton destruction. His theory was that there were shards of that previous system of beliefs, fears, mythologies that survived in story form in the Arthurian tales, in Beowolf, in Gawain, and other Old English remnants. Most of the transmission was done orally, so when that generation disappeared after Norman invasions of the 11c (1066 - Battle of Hastings) for the most part, collective memory subsumed some of these images. Tolkien's idea was to extract these and try to revive the uber-myths that they derived from. He was a philologue, meaning that he studies in-depth the origins of the English language and chaired the Philology Department at Oxford for decades. Old English and its offspring Middle English owed their origins to various Nordic tongues (Old Norse, Old Icelandic) and eventually, the invading Norsemen brought their culture and religion and especially their languate ultimately fusing all of these into what became the Modern English that I am writing in now. In fact, Tolkien's translation of Beowolf is still a reference for scholars of Old English even today. All that to say that in reading the oldest extant myths in the ""Old"" languages, Tolkien got a sense that there was something important that was hidden just beneath the surface, and he spent nearly his entire life as a linguistic speleologue trying to find it - sort of a human Dorin mining Moria to find the original stories. The Elves represent the very first humanoids to arrive in England whereas the Dwarves represent the various invasions from Norway, Finland, Sweden, Denmark and Iceland before 1000. Men are those who populated the Middle Ages and Hobbits are sort of the archetype of the middle-class, landed but non-aristocratic gentry in the villages of England. Perhaps the one place where political events in Tolkien's own life affect the narrative is in the episode at the very end of The Scouring of the Shire. Here we see History catch up with the Idyllic and somewhat isolated Shire where violence (the sad, pathetic revenge of Saruman on Bilbo and Frodo for having thwarted his plans) rages across the land, nature is destroyed, and industrialization arises. This represents the Industrial Revolution but also the coming of age for Tolkien himself in WWI and, I would argue, the bombing of Oxford during the Battle of Britain during WWII that he experienced first-hand as well. It is interesting that this is included as a coda after the main action of the epic is already concluded, as if he had this one other thing to say before sending Gandalf, Frodo and Bilbo off to Grey Haven with the Elves, thus definitively ending the pre-Modern Middle Earth (and by extension Medieval and Revolutionary Europe) and entering into the Modern/Industrial Age. 
Ecology
I wrote quite a lot about Tolkien's sensibility to nature in my previous LOTR reviews (see below), but I wanted to reiterate that in these books, nature itself is a character in the saga. When Tolkien talks about flowers or herbs, his descriptions are lush in detail and even anthropomorphic as it comes to trees (Ents for example). Indeed, recalling what I said above about his pining for an England before the agricultural and industrial revolutions when the great primitive forests still covered England and all of Europe, he bemoans the loss of this environment time and time again. Most poignantly, I think, with Treebeard's sad resignation at the definitive disappearance of Entmaidens which spells certain death for his species. Sam is able to bear the destruction of Hobbiton to a degree, but when he sees the Party Tree under which Bilbo gave his Farewell Speech destroyed and lying dead on the ground, something breaks inside of him. Nature in LOTR is a living, breathing thing and critical to the success of the mission: without the Ents, the Battle of Isengard would certainly have not been such a definitive defeat for Sarumon (another reason why he attacked not only Hobbits but trees as well in his Scouring of the Shire). The loss of communication between Man and Forest is one of the reasons for the breakdown in relationships between Rohan and Gondor as well as that between Elves and Men, thus the marriages of Faramir and Eowyn and Aragorn and Arwen are so important for reforging those bonds and replanting the forests that were impacted by the war. Once communication has been reestablished and the forests resume their role in connecting communities, peace can once again attempt to thrive.Lastly, I would point out that this sense of the importance of ecology has completely disappeared from fantasy (and its modern derivation of dystopias) literature (at least as far as I have read). The stories of Harry Potter, Hunger Games, the Grishaverse, and so on have pushed trees and nature into a Hollywood backdrop for the most part. This is rather unfortunate because that means that the generations after LOTR did not really have a solid basis of awareness about man's intimate connection to nature making it easier to deny the grim reality of climate change and ecological destruction since it is seen as superficially unrelated to their daily lives. Fortunately, the tide seems to be turning as evidenced by the Pulitzer Prize for Fiction given to Richard Ford's excellent The Overstory.
Sexuality
The last theme I wanted to touch on briefly was sexuality. For the most part, the world of Middle Earth is asexual. The relationships between the paired characters, say, Sam and Frodo and Legolas and Gimli, are those of deep, intimate but strictly non-sexual friendships. In the case of Sam and Frodo, I suppose that it could be argued that Sam sometimes has a man-crush on Frodo, but it is not truly reciprocated nor acted on other than their relationship involving more hugs and handholding than other friendships in the book. As for the Elves, we have several gorgeous women Elves: Arwen and Galadriel, but both are asexual (at least until Arwen weds Aragorn) despite provoking deep reverence in Merry, it remains platonic and more of a one-sided infatuation. There is little mention of rape in LOTR even during the war, this book having originally being intended as a sequel to the child-focused The Hobbit, or There and Back Again, perhaps that plus the natural British tendency to whitewash unsightly behavior was at play.For the most part, women play a secondary or tertiary role in LOTR. At one point, Galadriel could become a supremely powerful figure, but she renounces it in The Two Towers after looking into her Mirror and seeing the consequences. The notable exception to this is, of course, Eowyn who revendicates her status of independence from her 'cage' and who slays the King of the Nazgûl in revenge of the death of her father and both protecting Merry and saving the outcome of the battle for the good guys with her immortal: ""For no man am I!"" speech. That being said, she is obliged to give up her love for Aragorn and settle for Faramir, who fortunately has a good heart and seems to truly love her at first sight. What I am getting at is that Eowyn escapes her fate as a non-actor in history with her act in the battlefield, but does not escape her destiny becoming a wife to a man at the end. Perhaps in that sense, Galadriel does remain a heroic figure, if more passive than Eowyn, she retains her total independence and a modicum of power, being one of the last two Ring holders with Gandalf.Gandalf's lack of sexuality is interesting. Perhaps folks were put off by the adage that one must never delve into the affairs of wizards because they are of short and violent humor. In any case, he is clearly not homosexual (unlike his distant cousin Dumbledore according to Rowling (https://www.nbcnews.com/think/opinion...)). He is more an archetype of the Catholic God the Father than the sex-hound Jove. 
Suite et fin
Well, I hope you appreciated these thoughts about LOTR and that it will encourage you to reread this classic and be more environmentally-aware going forward. Long live Middle Earth!Fino's Tolkien Reviews:The HobbitThe Fellowship of the Ring (LOTR 1)The Two Towers (LOTR 2)The Return of the King (LOTR 3)Lord of the Rings 1-3 - General Comments and ObservationsRaymond Edward's Tolkien biography"
24,"Lovely little adventure a la Bill Bryson
No one knows, incidentally, why Australia's spiders are so extravagantly toxic; capturing small insects and injecting them with enough poison to drop a horse would appear to be the most literal case of overkill. Still, it does mean that everyone gives them lots of space.
What an absolutely stunning  endorsement. As with his other traveling books, Bill Bryson hip hops his way across a country - visiting monuments and interviewing natives. We meet quirky characters and Australian wildlife galore - from the poisonous snakes to the brutal kookaburra  Incidentally, did you know that the kookaburra likes to bash its prey until their bones have been pulverized? Apparently its easier to digest that way...lovely...He also has quite a lot to say about Australians: 
They spend half of any conversation insisting that the country's dangers are vastly overrated and that there's nothing to worry about, and the other half telling you how six months ago their Uncle Bob was driving to Mudgee when a tiger snake slid out from under the dashboard and bit him on the groin, but that it's okay now because he's off the life support machine and they've discovered he can communicate with eye blinks.
 To be fair, Bill Bryson does have plenty of good things to say about Australia. As he goes from town to town, he describes delicious sounding dishes and has a way with describing the atmosphere such that you feel like you are really there. About halfway through the book, I did start to get a bit bored (this book became a bit samey-samey with every town he visited). That being said, I did enjoy reading this somewhat unusual trek through Australia.Audiobook CommentsNothing too special - was well-read if a bit bland in tone/inflection.YouTube | Blog | Instagram | Twitter | Snapchat @miranda.reads Happy Reading!"
24,"I love Bill Bryson. Yep, it's a full-blown, one-sided bromance. Bryson could write a book about the history of the individual rooms within the typical house and I would love it (he did and I did)! So, when I discovered he'd written about his experiences while traveling Australia, I knew I'd found my next good read! In a Sunburned Country takes in the Land Down-Under, from today traveling all the way back to its earliest historical findings. You expect and get a look at modern Australia, its UK-convict days, Sydney and other cities, the bush, the outback, and the plight, trials and importance of the aborigines. All of the above also comes with a healthy dose of Bryson humor. It's self-deprecating, it's consciously delusional for comedy's sake, it's honest and it gives me the chuckles. I appreciate that he puts himself in awkward situations and really enjoy his description of scenes in which he is a participating victim. Australia has countless ways to kill a person, what with all its deadly animals, so there's plenty of opportunity for hair-raising hilarity, especially considering Bryson's the sort of guy who could get himself savaged by a hedgehog. Fun is fun and all, but in the end this book is about the knowledge, so if you have an interest in learning more about Australia, I couldn't recommend another book more highly. The author is a full-on philomath and he loves this country, so the reader is treated to a veritable love-fest spewed all over the pages of In a Sunburned Country!"
24,"Bill Bryson never seems to use the same approach to each of his books. Is this book going to be snarky Bill? Is this going to be funny Bill? Is this going to be funny, yet informative Bill? Is this going to be snarky, yet informative Bill? I could go on, but my hands would start to cramp up with the unlimited combinations.This one is reverential, informative, and mostly self-effacing humor Bill. Bill loves Australians, but he hates the fact that the country is over-run with hordes of killer species and there’s a big hot-assed desert in the middle of the continent.Australians are lovely people. The one’s I’ve known were incredibly friendly and generous. I worked with a couple who were touring the United States and working at odd jobs along the way. When they were leaving, they gave me their contact information and invited me to visit at any time. If they are reading this, my family will be down under in a week or so and plan to stay for about a month. We don’t eat much beyond shrimp and steak and don’t wish to try vegemite, so thanks and keep that stuff to yourself. So good onya, mates and crikey and stuff!!Although it’s a topic that needs examining, Bryson’s writing on the treatment of Aborigines seems out of place and shrill compared with the Australian lovefest and repeated warnings about deadly jelly fish, killer spiders and gun-toting snakes.This was a buddy read with la doyenne of non-fiction buddy reads: Le Trish."
